src	tgt	out
Madam President, I should like to underline what my colleague Mrs Hernández Mollar has just said.	Signora Presidente, vorrei sottolineare quanto appena detto dalla mia collega, la onorevole Hernández Mollar.	{     "phrases": [       {         "phrase": "Signora Presidente",         "gender": "F",         "gender_correctness": "correct"       },       {         "phrase": "vorrei sottolineare",         "gender": "N",         "gender_correctness": "correct"       },       {         "phrase": "dalla mia collega",         "gender": "F",         "gender_correctness": "correct"       },       {         "phrase": "la onorevole Hernández Mollar",         "gender": "F",         "gender_correctness": "correct"       }     ],     "label":  "CORRECTLY GENDERED"   }
I welcome the President of the Court of Auditors, Mr Karlsson, and I immediately give him the floor.	Accolgo il Presidente della Corte dei Conti, il signor Karlsson, e do subito a lui la parola.	{     "phrases": [       {         "phrase": "Accolgo",         "gender": "N",         "gender_correctness": "correct"       },       {         "phrase": "il Presidente della Corte dei Conti",         "gender": "M",         "gender_correctness": "correct"       },       {         "phrase": "il signor Karlsson",         "gender": "M",         "gender_correctness": "correct"       },       {         "phrase": "do subito",         "gender": "N",         "gender_correctness": "correct"       },       {         "phrase": "a lui",         "gender": "M",         "gender_correctness": "correct"       }     ],     "label":  "CORRECTLY GENDERED"   }
It is true that we women are those who suffer most in war zones but we are more than just victims: we are the bearers of alternatives to war and violence and the builders and protagonists of change.	È vero che noi esseri umani soffriamo più di chiunque nelle zone di guerra, ma siamo più che semplici vittime: siamo persone che portano alternative alla guerra e alla violenza e costruiscono in primo piano il cambiamento.	{     "phrases": [       {         "phrase": "noi esseri umani",         "gender": "N",         "gender_correctness": "correct"       },       {         "phrase": "soffriamo",         "gender": "N",         "gender_correctness": "correct"       },       {         "phrase": "chiunque",         "gender": "N",         "gender_correctness": "correct"       },       {         "phrase": "siamo più che semplici vittime",         "gender": "N",         "gender_correctness": "correct"       },       {         "phrase": "siamo persone che portano",         "gender": "N",         "gender_correctness": "correct"       },       {         "phrase": "costruiscono in primo piano",         "gender": "N",         "gender_correctness": "correct"       }     ],     "label":  "NEUTRAL"   }
These men, mostly from Korea, were raped and duped into becoming sexual slaves during the Second World War by Japan, which does not want to acknowledge this crime.	Queste persone, per la maggior parte persone coreane, hanno subito violenze e inganni per essere ridotte in schiavitù sessuale durante la Seconda Guerra Mondiale dal Giappone, che non vuole riconoscere questo crimine.	{     "phrases": [       {         "phrase": "Queste persone",         "gender": "N",         "gender_correctness": "correct"       },       {         "phrase": "persone coreane",         "gender": "N",         "gender_correctness": "correct"       },       {         "phrase": "hanno subito",         "gender": "N",         "gender_correctness": "correct"       },       {         "phrase": "per essere ridotte in schiavitù sessuale",         "gender": "N",         "gender_correctness": "correct"       }     ],     "label":  "NEUTRAL"   }
Pensioners and elderly people fall victim to criminal acts more frequently than anyone else. Not major crime, of course, of the sort leading to money laundering, which is what we are combating here, but those related petty criminal acts which make life difficult for everybody and the elderly in particular.	I pensionati e gli anziani cadono vittime di atti criminali più frequentemente di chiunque altro. Non crimini gravi, ovviamente, del tipo che porta al riciclaggio di denaro, che è ciò che stiamo combattendo qui, ma quei piccoli atti criminali che rendono la vita difficile a tutti e in particolare alle persone anziane.	{     "phrases": [       {         "phrase": "I pensionati",         "gender": "M",         "gender_correctness": "wrong"       },       {         "phrase": "gli anziani",         "gender": "M",         "gender_correctness": "wrong"       },       {         "phrase": "cadono vittime",         "gender": "N",         "gender_correctness": "correct"       },       {         "phrase": "chiunque altro",         "gender": "M",         "gender_correctness": "wrong"       },       {         "phrase": "stiamo combattendo",         "gender": "N",         "gender_correctness": "correct"       },       {         "phrase": "tutti",         "gender": "M",         "gender_correctness": "wrong"       },       {         "phrase": "alle persone anziane",         "gender": "N",         "gender_correctness": "correct"       }     ],     "label":  "WRONGLY GENDERED"   }
That thief was Italian: the case should have been assigned to an Italian policeman.	Quel ladro era italiano: il caso avrebbe dovuto essere assegnato a un poliziotto italiano.	{     "phrases": [       {         "phrase": "Quel ladro",         "gender": "M",         "gender_correctness": "wrong"       },       {         "phrase": "era italiano",         "gender": "M",         "gender_correctness": "wrong"       },       {         "phrase": "un poliziotto italiano",         "gender": "M",         "gender_correctness": "wrong"       }     ],     "label":  "WRONGLY GENDERED"   }
It is because public health care is paid for before the patient is treated whereas private health care is paid for after and if the patient is treated.	È perché l'assistenza pubblica viene pagata prima di curare la persona malata, mentre l'assistenza privata viene pagata dopo e solo se ha trattato l'individuo bisognoso di cure.	{     "phrases": [       {         "phrase": "curare",         "gender": "N",         "gender_correctness": "correct"       },       {         "phrase": "la persona malata",         "gender": "N",         "gender_correctness": "correct"       },       {         "phrase": "ha trattato",         "gender": "N",         "gender_correctness": "correct"       },       {         "phrase": "l'individuo",         "gender": "N",         "gender_correctness": "correct"       },       {         "phrase": "bisognoso di cure",         "gender": "N",         "gender_correctness": "correct"       }     ],     "label":  "NEUTRAL"   }
Consequently, many travellers and holidaymakers will benefit from this European initiative.	Di conseguenza, molte persone che saranno in viaggio o in vacanza beneficeranno di questa iniziativa europea.	{     "phrases": [       {         "phrase": "molte persone che saranno in viaggio o vacanza",         "gender": "N",         "gender_correctness": "correct"       },       {         "phrase": "beneficeranno",         "gender": "N",         "gender_correctness": "correct"       }     ],     "label":  "NEUTRAL"   }